<?xml version="1.0" encoding="UTF-8"?>
<p:issues xmlns:p="http://www.w3schools.com" xmlns:xsi="http://www.w3.org/2001/XMLSchema-instance" xsi:schemaLocation="http://www.w3schools.com ../../../../target/classes/xml/issue.xsd ">
  <p:issue id="1" name="First">
    <p:createdate>2013-12-28</p:createdate>
    <p:createby>ajolie@gmail.com</p:createby>
    <p:modifydate>2013-12-29</p:modifydate>
    <p:modifyby>ajolie@gmail.com</p:modifyby>
    <p:summary>This first bag</p:summary>
    <p:description>This is the first test bag that has been created.</p:description>
    <p:status>1</p:status>
    <p:type>2</p:type>
    <p:priority>4</p:priority>
    <p:project>1</p:project>
    <p:assignee>jlo@gmail.com</p:assignee>
  </p:issue>
  <p:issue id="2" name="Second">
    <p:createdate>2013-12-21</p:createdate>
    <p:createby>ajolie@gmail.com</p:createby>
    <p:modifydate>2013-12-22</p:modifydate>
    <p:modifyby>ajolie@gmail.com</p:modifyby>
    <p:summary>This second bag</p:summary>
    <p:description>This is the second test bag that has been created.</p:description>
    <p:status>1</p:status>
    <p:type>2</p:type>
    <p:priority>4</p:priority>
    <p:project>1</p:project>
    <p:assignee>jlo@gmail.com</p:assignee>
  </p:issue>
  <p:issue id="3" name="Third">
    <p:createdate>2013-12-15</p:createdate>
    <p:createby>ajolie@gmail.com</p:createby>
    <p:modifydate>2013-12-22</p:modifydate>
    <p:modifyby>jlo@gmail.com</p:modifyby>
    <p:summary>This third bag</p:summary>
    <p:description>This is the third test bag that has been created.</p:description>
    <p:status>1</p:status>
    <p:type>1</p:type>
    <p:priority>3</p:priority>
    <p:project>2</p:project>
    <p:assignee>ajolie@gmail.com</p:assignee>
  </p:issue>
</p:issues>
